company,title,location,url
Tulip Interfaces,"Account Executive, Medical Devices","Somerville, MA",https://tulip.co/careers/job-posting/?gh_jid=7720118003
Patreon,"Fullstack Engineer, Creator Home","New York City, New York, United States; New York; San Francisco",https://jobs.ashbyhq.com/patreon/bc4a590b-ba06-4058-83ac-1c7f458277f8
Marathon Health,"Nurse Practitioner - Muncie, IN","Muncie, IN; United States of America",https://marathonhealth.wd501.myworkdayjobs.com/Marathon-Health-Careers/job/IN-Muncie/Nurse-Practitioner---Muncie--IN_JR107684
Rhythm Pharmaceuticals,"Manager, Field & Marketing Operations (Speaker Bureau)","Boston, MA, United States",http://rhythmpharmaceuticals.applytojob.com/apply/nyy6t4uZGS/Manager-Field-Marketing-Operations-Speaker-Bureau
Perplexity AI,Scaled Enterprise Customer Success Manager,"San Francisco, California, United States; San Francisco; New York City; Austin",https://jobs.ashbyhq.com/Perplexity/fdc2ea75-c198-4a9e-9c0a-df835ed61ed0
Robinhood,Financial Compliance Senior Associate,"Chicago, IL; Menlo Park, CA; New York, NY",https://boards.greenhouse.io/robinhood/jobs/7900932?t=gh_src=&gh_jid=7900932
IonQ,Senior Microwave Research Scientist,"Boston, Massachusetts, United States",https://job-boards.greenhouse.io/ionq/jobs/5997260004
Outrider,Autonomous Vehicle Test Operator (CDL-A),"San Antonio, TX",https://job-boards.greenhouse.io/outrider/jobs/4960265008
Databricks,Delivery Solutions Architect - Manufacturing,Central - United States; West Coast - United States,https://databricks.com/company/careers/open-positions/job?gh_jid=8549046002
Vori Health,Senior Data Integration Engineer (100% Remote),"Nashville HQ; Nashville, TN",https://recruiting.ultipro.com/VOR1001VORI/JobBoard/e5f59222-eab9-4772-8e33-f436c4f4a1f6/OpportunityDetail?opportunityId=28d0d10c-87d5-4165-a2c5-98df18bf562f
Omio,"AdTech & Programmatic Lead (Berlin, or remote - London, Prague, Barcelona)","London, England, GB",https://jobs.smartrecruiters.com/Omio1/744000127015362-adtech-programmatic-lead-berlin-or-remote-london-prague-barcelona-
Stash,Brokerage Operations Associate,New York,https://ats.comparably.com/api/v2/stash/post/7931258:?gh_jid=7931258
MoonPay,"Senior Director, Strategic Initiatives for MoonPay Institutional",United States - Remote,https://jobs.lever.co/moonpay/ec75f897-31ce-436a-b5e1-3420a883e131
Echodyne,Senior Engineering Manager,"Kirkland, WA",https://job-boards.greenhouse.io/echodynecorp/jobs/4681000006
VAST Data,QA Automation Engineer - Toronto,Toronto,https://www.comeet.com/jobs/vastdata/43.001/qa-automation-engineer---toronto/E2.B65
Valarian,Software Engineer,London,https://jobs.lever.co/valarian/872aec4d-d770-4962-a374-b278dcd513e2
Formlabs,Senior Materials Scientist,"Boston, MA",https://careers.formlabs.com/job/7930182/apply/?gh_jid=7930182
Curana Health,Medicare Benefit Consultant,"Pittsburgh, PA, US",https://general-careers-curanahealth.icims.com/jobs/3583/medicare-benefit-consultant/job
Nitra,Customer Success Strategy & Operations Lead,"New York, New York, USA",https://jobs.lever.co/nitra/152da5b9-bcf1-4b4e-a9a4-70bab00148ac
Wonder,"Associate Director, SMB Accounts",Chicago; United States of America; HQ,https://wonder.wd1.myworkdayjobs.com/WG/job/Chicago/Associate-Director--SMB-Accounts_JR101091-1
Tempus Labs,Quality Control Technologist I-II,Chicago; United States of America,https://tempus.wd5.myworkdayjobs.com/Tempus_Careers/job/Chicago/Quality-Control-Technologist-I-II_JR202600444
Plaid,Senior Data Scientist - Credit,"San Francisco, California, United States; San Francisco HQ; Seattle Office; New York City Office",https://jobs.ashbyhq.com/plaid/97bebd5a-2cdf-4663-922e-ef23108a33a0
Synthesia,"Frontend Engineer, Growth","London, Greater London, United Kingdom; London; UK Remote; Dublin; Germany; Zurich",https://jobs.ashbyhq.com/synthesia/52ad9ec7-5c48-46dc-9849-85c5af0039c0
Horizon3.ai,"IT Analyst, EMEA","Amsterdam, Netherlands; Amsterdam, Netherlands",https://jobs.ashbyhq.com/horizon3ai/f2c6c117-b403-4d1c-af46-29776df0de33
Twelve Labs,"Staff Machine Learning Engineer, Pegasus - TrainingOps","Seoul, South Korea; Seoul, South Korea",https://jobs.ashbyhq.com/twelve-labs/56d12488-ace7-4f7c-a156-6ca477014296
Assembled,Engineering Manager - Forecasting & Scheduling,"San Francisco, California , United States; Canada; United States; San Francisco, CA; Canada; United States",https://jobs.ashbyhq.com/assembledhq/2a6a56ca-4625-49a2-be88-a1332d8afd51
DataRobot,Customer Success Engineer,Japan,https://datarobot.wd1.myworkdayjobs.com/DataRobot_External_Careers/job/Remote-Japan/Customer-Success-Engineer_R-102663
NinjaOne,QA Engineer,United States; United States; United States; United States; United States; United States; United States; United States; United States; United States; United States; United States; United States; United States; United States; United States; United States; United States,https://jobs.jobvite.com/ninjaone/job/oIF8zfwO?nl=1&fr=true
Clio,Senior Strategy and Analytics Specialist,Toronto; Canada; Vancouver; Calgary,https://clio.wd3.myworkdayjobs.com/ClioCareerSite/job/Toronto/Senior-Strategy-and-Analytics-Specialist_REQ-4955
Together AI,AI Infrastructure Engineer,San Francisco,https://job-boards.greenhouse.io/togetherai/jobs/5138540007
Cloudflare,Network Engineering Intern (July to December 2026),In-Office,https://boards.greenhouse.io/cloudflare/jobs/7929538?gh_jid=7929538
Omada Health,"Vice President, Operational Excellence & Chief of Staff","Remote, USA",https://job-boards.greenhouse.io/omadahealth/jobs/7918592
eko,Warehouse Lead - Weeknights,"Bentonville, Arkansas",https://job-boards.greenhouse.io/eko/jobs/8549959002
"goop,com",Field Territory Manager,New York Office,https://job-boards.greenhouse.io/goop/jobs/5992062004
Resilience,Manufacturing Technician II - PET (dayshift)," West Chester,  OH , USA ; United States of America",https://resilience.wd1.myworkdayjobs.com/Resilience_Careers/job/USA---OH---West-Chester/Manufacturing-Technician-II---PET--dayshift-_R-106820
Automation Anywhere,Sr. Strategic Partnerships Manager,United States of America,https://automationanywhere.wd5.myworkdayjobs.com/AutomationAnywhereJobs/job/USA---Remote/Sr-Strategic-Partnerships-Manager_JR1372
Inkitt,Senior Accountant/Buchhalter (m/f/d),Remote EU,https://jobs.lever.co/inkitt/778f6449-65d5-42ee-87d9-846c74e4bf64
Radiology Partners,Interventional Physician Assistant - Radiology Partners Florida,"Hudson, FL",https://indeed.com/cmp/Radiology-Partners/jobs?jk=ebe85d2089aac74b
Instabase,Full-stack Software Engineer (New Grad),"San Francisco, CA",https://job-boards.greenhouse.io/instabase/jobs/8548929002
Caribou,Senior Product Manager,"Chicago, IL; Denver, CO; Phoenix, AZ; Remote, US",https://job-boards.greenhouse.io/caribou/jobs/7732512003
BuzzFeed,"Head of People, Studio","Los Angeles, CA",https://boards.greenhouse.io/buzzfeed/jobs/7921981?gh_jid=7921981
Strive Health,"Lead, AI Software Engineer","Denver, CO",https://job-boards.greenhouse.io/strivehealth/jobs/4680792006
Philo,Sr. Backend Software Engineer (Video Engineering),"San Francisco, CA, Brooklyn, NY, Cambridge, MA; remote within the U.S.",https://job-boards.greenhouse.io/philo/jobs/7919461
SetPoint Medical,Sr. Manufacturing Engineer I,SetPoint Medical Valencia Office 25101 Rye Canyon Loop Valencia CA 91355 USA,https://recruiting.paylocity.com/Recruiting/Jobs/Details/4147518
Uniphore,Marketing Intern," Palo Alto,  CA , USA ; United States of America",https://uniphore.wd503.myworkdayjobs.com/Uniphore/job/USA---CA---Palo-Alto/Marketing-Intern_JR101060
TAE Technologies,Sr. Design Engineer,"Copernicus Office; Irvine, CA",https://recruiting2.ultipro.com/TRI1021TRIAE/JobBoard/49386e5d-f909-4648-8335-415ce97e3f15/OpportunityDetail?opportunityId=32f84f19-2dc1-4ee9-874d-87abed33296d
Zuoyebang Education Technology,固定双休 作业辅导,重庆 渝中区,https://www.zhaopin.com/jobdetail/CC287198080J40863262114.htm
Hashgraph,"Sales Director, Financial Services - San Francisco",Remote within San Francisco Bay area,https://www.hashgraph.com/careers/8552556002?gh_jid=8552556002
Ledgy,Talent Acquisition Partner,"London, United Kingdom",https://job-boards.eu.greenhouse.io/ledgy/jobs/4868429101
Mejuri,Store Director,"Flatiron, New York City",https://job-boards.greenhouse.io/mejuri/jobs/4681003006
Tulip Interfaces,"Account Executive, Medical Devices",US - Remote,https://tulip.co/careers/job-posting/?gh_jid=7737621003
Robinhood,Executive Sourcer,"Chicago, IL; Menlo Park, CA; New York, NY",https://boards.greenhouse.io/robinhood/jobs/7932082?t=gh_src=&gh_jid=7932082
Databricks,Staff Software Engineer - AI Research Infrastructure,"New York City, New York; San Francisco, California",https://databricks.com/company/careers/open-positions/job?gh_jid=8552484002
Vori Health,Sales Development Representative (100% Remote),"Nashville HQ; Nashville, TN",https://recruiting.ultipro.com/VOR1001VORI/JobBoard/e5f59222-eab9-4772-8e33-f436c4f4a1f6/OpportunityDetail?opportunityId=ac43cb76-5139-4277-9abe-e56e0a771b57
Databricks,"Sr. Technology Partner Manager, Startup Program","San Francisco, California",https://databricks.com/company/careers/open-positions/job?gh_jid=8550948002
Robinhood,"Community Manager, Social","Menlo Park, CA; New York, NY",https://boards.greenhouse.io/robinhood/jobs/7922396?t=gh_src=&gh_jid=7922396
Stash,"Senior Director, Lifecycle Marketing",New York,https://ats.comparably.com/api/v2/stash/post/7930364:?gh_jid=7930364
IonQ,"Manager, Business Systems","Remote, US",https://job-boards.greenhouse.io/ionq/jobs/5994825004
Formlabs,Materials Scientist - Photopolymer Development,"Somerville, MA",https://careers.formlabs.com/job/7930175/apply/?gh_jid=7930175
Formlabs,SLS Materials Scientist,"Boston, MA",https://careers.formlabs.com/job/7930177/apply/?gh_jid=7930177
Formlabs,Materials Scientist,"Boston, MA",https://careers.formlabs.com/job/7930174/apply/?gh_jid=7930174
Formlabs,Senior Mechanical Engineer,"Somerville, MA",https://careers.formlabs.com/job/7930162/apply/?gh_jid=7930162
Formlabs,Senior Materials Scientist,"Somerville, MA",https://careers.formlabs.com/job/7930181/apply/?gh_jid=7930181
Formlabs,Mechanical Engineer,"Somerville, MA",https://careers.formlabs.com/job/7930155/apply/?gh_jid=7930155
Formlabs,Senior SLS Materials Scientist,"Boston, MA",https://careers.formlabs.com/job/7930183/apply/?gh_jid=7930183
Formlabs,Mechanical Engineer,"Boston, MA",https://careers.formlabs.com/job/7930158/apply/?gh_jid=7930158
Formlabs,Senior Robotic Systems Integration Engineer (SLA & SLS),"Boston, MA",https://careers.formlabs.com/job/7930150/apply/?gh_jid=7930150
Formlabs,Materials Scientist - Photopolymer Development,"Boston, MA",https://careers.formlabs.com/job/7930180/apply/?gh_jid=7930180
Formlabs,Robotic Systems Integration Engineer (SLA & SLS),"Somerville, MA",https://careers.formlabs.com/job/7930147/apply/?gh_jid=7930147
Formlabs,Robotic Systems Integration Engineer (SLA & SLS),"Boston, MA",https://careers.formlabs.com/job/7930148/apply/?gh_jid=7930148
Formlabs,Senior SLS Materials Scientist,"Somerville, MA",https://careers.formlabs.com/job/7930184/apply/?gh_jid=7930184
Formlabs,Senior Mechanical Engineer,"Boston, MA",https://careers.formlabs.com/job/7930163/apply/?gh_jid=7930163
Formlabs,R&D Reliability/Test Engineer,"Somerville, MA",https://careers.formlabs.com/job/7930160/apply/?gh_jid=7930160
Formlabs,SLS Materials Scientist,"Somerville, MA",https://careers.formlabs.com/job/7930179/apply/?gh_jid=7930179
Formlabs,R&D Reliability/Test Engineer,"Boston, MA",https://careers.formlabs.com/job/7930161/apply/?gh_jid=7930161
Formlabs,Materials Scientist,"Somerville, MA",https://careers.formlabs.com/job/7930173/apply/?gh_jid=7930173
Formlabs,Senior Robotic Systems Integration Engineer (SLA & SLS),"Somerville, MA",https://careers.formlabs.com/job/7930149/apply/?gh_jid=7930149
Databricks,Data and AI Solution Architect (Professional Services),"Munich, Germany",https://databricks.com/company/careers/open-positions/job?gh_jid=8554531002
Rhythm Pharmaceuticals,"Field Sales Director, BBS (National)","Dallas, TX, United States",http://rhythmpharmaceuticals.applytojob.com/apply/quvzIskMzP/Field-Sales-Director-BBS-National
Rhythm Pharmaceuticals,"Director, Non-Personal Marketing","Boston, MA, United States",http://rhythmpharmaceuticals.applytojob.com/apply/aB0FcZb7B7/Director-NonPersonal-Marketing
Curana Health,Nurse Practitioner or Physician Assistant,"Fairfax, VA, US",https://general-careers-curanahealth.icims.com/jobs/3633/nurse-practitioner-or-physician-assistant/job
Marathon Health,Nurse Practitioner,"Salem, OH; United States of America",https://marathonhealth.wd501.myworkdayjobs.com/Marathon-Health-Careers/job/OH-Salem/Nurse-Practitioner_JR107677
Databricks,"RVP, Enterprise (Health & Life Sciences)",United States,https://databricks.com/company/careers/open-positions/job?gh_jid=8548505002
Marathon Health,"Family Nurse Practitioner - Taylor, MI","Taylor, MI; United States of America",https://marathonhealth.wd501.myworkdayjobs.com/Marathon-Health-Careers/job/MI-Taylor/Family-Nurse-Practitioner---Taylor--MI_JR107566-1
Tempus Labs,"Staff/Senior Machine Learning Engineer, Clinical AI",Chicago; United States of America; Boston; Redwood City; Seattle; New York City,https://tempus.wd5.myworkdayjobs.com/Tempus_Careers/job/Chicago/Staff-Senior-Machine-Learning-Engineer--Clinical-AI_JR202600443
Perplexity AI,"Design Director, Brand & Marketing","New York City, New York, United States; San Francisco, California, United States; New York City; San Francisco",https://jobs.ashbyhq.com/Perplexity/4eeb7b0f-9370-40e8-94de-faf3e4312ed0
Marathon Health,"Physician Assistant or Family Nurse Practitioner - Watsonville, CA $15,000 sign-on bonus","Freedom, CA; United States of America",https://marathonhealth.wd501.myworkdayjobs.com/Marathon-Health-Careers/job/CA-Freedom/Physician-Assistant-or-Family-Nurse-Practitioner---Watsonville--CA--15-000-sign-on-bonus_JR107699
Patreon,"Senior Staff Software Engineer, Backend Platform","San Francisco, California, United States; San Francisco; New York",https://jobs.ashbyhq.com/patreon/c277b009-0c9c-4ae7-a72b-56aaad0d985c
Plaid,Senior Data Scientist - Network Value,"San Francisco, California, United States; San Francisco HQ; New York City Office; Seattle Office",https://jobs.ashbyhq.com/plaid/fe492bdf-699c-4d70-97e3-4fb9d69b1287
Marathon Health,Vice President of Legal,United States of America,https://marathonhealth.wd501.myworkdayjobs.com/Marathon-Health-Careers/job/Remote/Vice-President-of-Legal--Corporate_JR107664
Marathon Health,"Family Physician - Pontiac, MI","Pontiac, MI; United States of America",https://marathonhealth.wd501.myworkdayjobs.com/Marathon-Health-Careers/job/MI-Pontiac/Family-Physician---Pontiac--MI_JR107565
Patreon,Scaled Partner Manager,"New York City, New York, United States; New York; San Francisco",https://jobs.ashbyhq.com/patreon/3f7eadf7-e0c3-4806-82c5-6218e2fbfde6
Robinhood,Senior Crypto AML Investigator,"Denver, CO; New York, NY; Westlake, TX",https://boards.greenhouse.io/robinhood/jobs/7760310?t=gh_src=&gh_jid=7760310
Robinhood,Finance & Strategy Senior Analyst,"Menlo Park, CA",https://boards.greenhouse.io/robinhood/jobs/7456663?t=gh_src=&gh_jid=7456663
Robinhood,"Data Scientist, ML (Agentic, CX)","Menlo Park, CA; New York, NY",https://boards.greenhouse.io/robinhood/jobs/7489476?t=gh_src=&gh_jid=7489476
Databricks,Delivery Solutions Architect - Public Sector,New Jersey,https://databricks.com/company/careers/open-positions/job?gh_jid=8550331002
Formlabs,Senior Electrical Engineer,"Somerville, MA",https://careers.formlabs.com/job/7926746/apply/?gh_jid=7926746
Formlabs,Electrical Engineer,"Somerville, MA",https://careers.formlabs.com/job/7926665/apply/?gh_jid=7926665
Omada Health,"Senior Manager, Tax","Remote, USA",https://job-boards.greenhouse.io/omadahealth/jobs/7859674
Formlabs,Senior 3D Print Optimization Engineer,"Boston, MA",https://careers.formlabs.com/job/7926275/apply/?gh_jid=7926275
Formlabs,3D Print Optimization Engineer,"Boston, MA",https://careers.formlabs.com/job/7926267/apply/?gh_jid=7926267
Formlabs,3D Print Optimization Engineer,"Somerville, MA",https://careers.formlabs.com/job/7926271/apply/?gh_jid=7926271
Formlabs,Senior 3D Print Optimization Engineer,"Somerville, MA",https://careers.formlabs.com/job/7926272/apply/?gh_jid=7926272
IonQ,Senior Quantum Scientist,"Boulder, Colorado, United States",https://job-boards.greenhouse.io/ionq/jobs/5986072004
Formlabs,Robotic Systems Integration Manager,"Somerville, MA",https://careers.formlabs.com/job/7931319/apply/?gh_jid=7931319
Echodyne,Debug and Test Supervisor,"Kirkland, WA",https://job-boards.greenhouse.io/echodynecorp/jobs/4681382006
Curana Health,Director of Clinical Operations (Nurse Practitioner or Physician Assistant),"Buffalo, NY, US",https://general-careers-curanahealth.icims.com/jobs/3597/director-of-clinical-operations-%28nurse-practitioner-or-physician-assistant%29/job
Rhythm Pharmaceuticals,"Territory Manager, BBS (Central)","Nashville, TN, United States",http://rhythmpharmaceuticals.applytojob.com/apply/s6kGxJGMAl/Territory-Manager-BBS-Central
Rhythm Pharmaceuticals,"Territory Manager, BBS (Mid Atlantic)","Philadelphia, PA, United States",http://rhythmpharmaceuticals.applytojob.com/apply/ra4j7SXcUs/Territory-Manager-BBS-Mid-Atlantic
Rhythm Pharmaceuticals,"Territory Manager, BBS (Florida)","Orlando, FL, United States",http://rhythmpharmaceuticals.applytojob.com/apply/Hqm7lPVFwo/Territory-Manager-BBS-Florida
Rhythm Pharmaceuticals,"Territory Manager, BBS (Southwest)","Los Angeles, CA, United States",http://rhythmpharmaceuticals.applytojob.com/apply/OeRbTQNVtk/Territory-Manager-BBS-Southwest
Rhythm Pharmaceuticals,"Territory Manager, BBS (Northwest)","San Francisco, CA, United States",http://rhythmpharmaceuticals.applytojob.com/apply/Hv038VmIWZ/Territory-Manager-BBS-Northwest
Rhythm Pharmaceuticals,"Territory Manager, BBS (Texas)","Dallas, TX, United States",http://rhythmpharmaceuticals.applytojob.com/apply/GfOUMIVwvu/Territory-Manager-BBS-Texas
Rhythm Pharmaceuticals,"Territory Manager, BBS (Southeast)","Charlotte, NC, United States",http://rhythmpharmaceuticals.applytojob.com/apply/0GSDgSwzez/Territory-Manager-BBS-Southeast
Clio,Senior Technical Talent Acquisition Specialist (12 Month Fixed Term),Toronto; Canada; Vancouver; Calgary,https://clio.wd3.myworkdayjobs.com/ClioCareerSite/job/Toronto/Senior-Technical-Talent-Acquisition-Specialist--12-Month-Contract-_REQ-4926
Plaid,"Product Counsel, Payments","San Francisco, California, United States; San Francisco HQ",https://jobs.ashbyhq.com/plaid/b7d60f30-ca33-4434-bb47-fa16d45b4e4a
Marathon Health,"Medical Assistant - (Part Time 24 hours per week with Full benefits and PTO)-Hanover, MD","Hanover, MD; United States of America",https://marathonhealth.wd501.myworkdayjobs.com/Marathon-Health-Careers/job/MD-Hanover/Medical-Assistant----Part-Time-24-hours-per-week-with-Full-benefits-and-PTO--Hanover--MD_JR107480
Marathon Health,"Nurse Practitioner (Full Time with Benefits and Flex Time) Columbus, GA","Columbus, GA; United States of America",https://marathonhealth.wd501.myworkdayjobs.com/Marathon-Health-Careers/job/GA-Columbus/Nurse-Practitioner--Full-Time-with-Benefits-and-Flex-Time--Columbus--GA_JR107609
Marathon Health,Clinical Applications Trainer,United States of America,https://marathonhealth.wd501.myworkdayjobs.com/Marathon-Health-Careers/job/Remote/Clinical-Applications-Trainer_JR107572-1
Marathon Health,"Nurse Practitioner or Physician Assistant - Gainesville, GA - 8 hours per week","Gainesville, GA; United States of America",https://marathonhealth.wd501.myworkdayjobs.com/Marathon-Health-Careers/job/GA-Gainesville/Nurse-Practitioner-or-Physician-Assistant---Gainesville--GA---8-hours-per-week_JR107656-1
Marathon Health,"Medical Assistant - Charlotte, NC (Albemarle Road)","Charlotte, NC; United States of America",https://marathonhealth.wd501.myworkdayjobs.com/Marathon-Health-Careers/job/NC-Charlotte/Medical-Assistant---Charlotte--NC--Albemarle-Road-_JR107688
Marathon Health,"Medical Assistant (Full Time with PTO and Benefits) -Enid, OK","Enid, OK; United States of America",https://marathonhealth.wd501.myworkdayjobs.com/Marathon-Health-Careers/job/OK-Enid/Medical-Assistant--Full-Time-with-PTO-and-Benefits---Enid--OK_JR107668
Plaid,Finance Systems Manager,"San Francisco, California, United States; San Francisco HQ",https://jobs.ashbyhq.com/plaid/52a328ed-b809-4996-9601-595e5a6a72a8
Marathon Health,"Certified/Registered Medical Assistant - Cherry Hill, NJ","Cherry Hill, NJ; United States of America",https://marathonhealth.wd501.myworkdayjobs.com/Marathon-Health-Careers/job/NJ-Cherry-Hill/Certified-Registered-Medical-Assistant---Cherry-Hill--NJ_JR107652
Resilience,Senior Human Resources Business Partner," Meadowpine Blvd,  Mississauga ,  ON , CAN ; Canada",https://resilience.wd1.myworkdayjobs.com/Resilience_Careers/job/CAN---ON---Mississauga---Meadowpine-Blvd/Senior-Human-Resources-Business-Partner_R-106841
Tempus Labs,"Senior Variant Scientist, Pod Supervisor",United States of America,https://tempus.wd5.myworkdayjobs.com/Tempus_Careers/job/Remote---Illinois/Senior-Variant-Scientist--Pod-Supervisor_JR202600439-1
Formlabs,Mechanical Engineering Manager,"Somerville, MA",https://careers.formlabs.com/job/7930955/apply/?gh_jid=7930955
Robinhood,"Senior Software Engineer, Data Compute","Bellevue, WA",https://boards.greenhouse.io/robinhood/jobs/7922957?t=gh_src=&gh_jid=7922957
Omada Health,"Vice President, Commercial Operations","Remote, USA",https://job-boards.greenhouse.io/omadahealth/jobs/7913366
Together AI,Sr. Revenue Accountant,San Francisco,https://job-boards.greenhouse.io/togetherai/jobs/5135637007
Together AI,Infrastructure Accounting Manager,San Francisco,https://job-boards.greenhouse.io/togetherai/jobs/5134279007
Robinhood,"Director of Operations, Crypto","New York, NY",https://boards.greenhouse.io/robinhood/jobs/7839509?t=gh_src=&gh_jid=7839509
Databricks,Solutions Architect - MFG,United States,https://databricks.com/company/careers/open-positions/job?gh_jid=8530861002
Patreon,Scaled Creator Growth Manager - Contract,"New York City, New York, United States; New York",https://jobs.ashbyhq.com/patreon/ef72af08-30f0-4684-ae64-3a57f3fbb4bf
Databricks,"Director, Field Engineering",United States,https://databricks.com/company/careers/open-positions/job?gh_jid=8541998002
Marathon Health,"Full Time Nurse Practitioner or Physician Assistant - Glenwood Springs, CO","Glenwood Springs, CO; United States of America",https://marathonhealth.wd501.myworkdayjobs.com/Marathon-Health-Careers/job/CO-Glenwood-Springs/Full-Time-Nurse-Practitioner-or-Physician-Assistant---Glenwood-Springs--CO_JR107603
Marathon Health,Senior Help Desk Technician,United States of America,https://marathonhealth.wd501.myworkdayjobs.com/Marathon-Health-Careers/job/Remote/Senior-Help-Desk-Technician_JR107628
Clio,"Platform Engineer, Databases",Toronto; Canada; Vancouver; Calgary,https://clio.wd3.myworkdayjobs.com/ClioCareerSite/job/Toronto/Platform-Engineer--Databases_REQ-4984
Horizon3.ai,"Director, Systems, Data, & Process Operations","United States; US, Remote",https://jobs.ashbyhq.com/horizon3ai/6b2bc47c-7a5d-4bca-a10c-8a79cb7f977d
Marathon Health,"Licensed Practical Nurse - (Full Time with Benefits and PTO)  Columbus, GA","Columbus, GA; United States of America",https://marathonhealth.wd501.myworkdayjobs.com/Marathon-Health-Careers/job/GA-Columbus/Licensed-Practical-Nurse----Full-Time-with-Benefits-and-PTO---Columbus--GA_JR107632
Clio,Talent Acquisition Sourcer,Vancouver; Canada; Toronto; Calgary,https://clio.wd3.myworkdayjobs.com/ClioCareerSite/job/Vancouver/Talent-Acquisition-Sourcer_REQ-4290
Clio,"Senior Software Developer, Voice & Messaging",Vancouver; Canada; Toronto; Calgary,https://clio.wd3.myworkdayjobs.com/ClioCareerSite/job/Vancouver/Senior-Software-Developer--Voice---Messaging_REQ-4841
Marathon Health,"Health Center Lead/Medical Assistant - White Bear Lake, MN","White Bear Lake, MN; United States of America",https://marathonhealth.wd501.myworkdayjobs.com/Marathon-Health-Careers/job/MN-White-Bear-Lake/Health-Center-Lead-Medical-Assistant---White-Bear-Lake--MN_JR107655
Assembled,Strategic Partnership Manager,"New York City, New York, United States; New York City, NY",https://jobs.ashbyhq.com/assembledhq/dee39bd1-4745-44b3-8861-5859de32f7b0
Tempus Labs,Medical Science Liaison I,United States of America,https://tempus.wd5.myworkdayjobs.com/Tempus_Careers/job/Remote---Florida/Medical-Science-Liaison-I_JR202600434
Marathon Health,"Nurse Practitioner - Columbus, NC - 4 hours per week","Columbus, NC; United States of America",https://marathonhealth.wd501.myworkdayjobs.com/Marathon-Health-Careers/job/NC-Columbus/Nurse-Practitioner---Columbus--NC---4-hours-per-week_JR107662
Marathon Health,"Medical Receptionist - Washington Square - Indianapolis, IN","Indianapolis, IN; United States of America",https://marathonhealth.wd501.myworkdayjobs.com/Marathon-Health-Careers/job/IN-Indianapolis/Medical-Receptionist---Washington-Square---Indianapolis--IN_JR107650
Marathon Health,Mental Health Specialist for Onsite Health Center,"Warrenton, VA; United States of America",https://marathonhealth.wd501.myworkdayjobs.com/Marathon-Health-Careers/job/VA-Warrenton/Mental-Health-Specialist-for-Onsite-Health-Center_JR107663-1
Perplexity AI,Account Executive,"San Francisco, California, United States; San Francisco; New York City",https://jobs.ashbyhq.com/Perplexity/acd466ba-536f-49da-968a-15b8c53298f8
Horizon3.ai,Partner Customer Success Manager,"United States; US, Remote",https://jobs.ashbyhq.com/horizon3ai/70833f2c-2bb7-489b-96c5-113a20c57508
