company,title,location,url
Resilience,"Manufacturing Specialist II, Training and Process Support"," East Norriton,  PA , USA ; United States of America",https://resilience.wd1.myworkdayjobs.com/Resilience_Careers/job/USA---PA---East-Norriton/Manufacturing-Specialist-II--Training-and-Process-Support_R-106763
Clio,Senior Machine Learning Operations Engineer,Toronto; Canada,https://clio.wd3.myworkdayjobs.com/ClioCareerSite/job/Toronto/Senior-Machine-Learning-Operations-Engineer_REQ-4900
Marathon Health,MA,"Novi, MI; United States of America",https://marathonhealth.wd501.myworkdayjobs.com/Marathon-Health-Careers/job/MI-Novi/MA_JR107493
Radiology Partners,Patient Care Advocate | Float | Varied Shift,"Austin, TX",https://indeed.com/cmp/Radiology-Partners/jobs?jk=1b338c2702510375
Radiology Partners,"Patient Care Advocate | Float | M-F, Varied Shift","Austin, TX",https://indeed.com/cmp/Radiology-Partners/jobs?jk=6243be513ed97b95
Radiology Partners,"Ultrasound Technologist | Rock Creek | Full-Time, Days","Austin, TX",https://indeed.com/cmp/Radiology-Partners/jobs?jk=4ee843a257a2059f
MoonPay,Solutions Engineer,Spain - Remote,https://jobs.lever.co/moonpay/68b92969-b011-41ea-814c-a16c837dd772
Nitra,Customer Success Manager,"Washington, District of Columbia, USA",https://jobs.lever.co/nitra/c7acf69a-90fe-4321-b2c7-a21c926e8746
Nitra,GTM Enablement Manager,"Washington, District of Columbia, USA",https://jobs.lever.co/nitra/2bc8de4e-7685-433a-984c-4955edcde71c
Databricks,Engineering Manager - App Frameworks,"Mountain View, California",https://databricks.com/company/careers/open-positions/job?gh_jid=8510921002
Greenlight,Strategic Finance Manager,Atlanta (Remote Friendly),https://jobs.lever.co/greenlight/ccc859c5-4796-4b20-99cb-885c4be03a29
VAST Data,Account Executive - Major Accounts,"East Coast, United States",https://www.comeet.com/jobs/vastdata/43.001/account-executive---major-accounts/6D.76B
Formlabs,Senior People Business Partner,"Boston, MA",https://careers.formlabs.com/job/7833521/apply/?gh_jid=7833521
Formlabs,Senior People Business Partner,"Somerville, MA",https://careers.formlabs.com/job/7833516/apply/?gh_jid=7833516
SingleStore,Lead Value Engineer,United States,https://job-boards.greenhouse.io/singlestore/jobs/7776421
Robinhood,"Senior Partnerships Manager, Crypto","New York, NY",https://boards.greenhouse.io/robinhood/jobs/7816451?t=gh_src=&gh_jid=7816451
BuzzFeed,"SVP, Finance & Accounting, Studios","Los Angeles, CA",https://boards.greenhouse.io/buzzfeed/jobs/7821595?gh_jid=7821595
Cloudflare,"Senior Named Account Executive, Boston",Hybrid,https://boards.greenhouse.io/cloudflare/jobs/7842776?gh_jid=7842776
Evident,Senior Software Engineer,"Atlanta, Georgia",https://jobs.lever.co/evidentid/a6a74ec3-7545-46cf-835d-b6523f9d547c
MoonPay,"Manager, KYB Operations",Portugal - Remote,https://jobs.lever.co/moonpay/cc058762-33ee-48ca-98af-5310bd7f33f3
SingleStore,Site Reliability Engineer,Portugal,https://job-boards.greenhouse.io/singlestore/jobs/7775074
Perplexity AI,Product Manager (Builder),"San Francisco, California, United States; Palo Alto, California, United States; San Francisco; Palo Alto",https://jobs.ashbyhq.com/Perplexity/f25e190e-0508-4707-b575-fcaed358dc13
Databricks,Geo Core Account Executive - UAE,"London, United Kingdom",https://databricks.com/company/careers/open-positions/job?gh_jid=8518847002
Cloudflare,Territory Account Executive,Hybrid,https://boards.greenhouse.io/cloudflare/jobs/7774559?gh_jid=7774559
Cloudflare,Senior Engineering Manager - Workers KV,Hybrid,https://boards.greenhouse.io/cloudflare/jobs/7841019?gh_jid=7841019
Nitra,Founding Enterprise Account Executive,"Washington, District of Columbia, USA",https://jobs.lever.co/nitra/aed52c18-9cab-4fad-a61a-69cd3b160911
Nitra,Founding Enterprise Account Executive,"New York, New York, USA",https://jobs.lever.co/nitra/84b20f45-86e1-4b19-b36e-0dce4086ab6b
Databricks,"Named Enterprise Account Executive, Fashion & Retail","Milan, Italy",https://databricks.com/company/careers/open-positions/job?gh_jid=8509687002
Databricks,"Enterprise Account Executive, New Business","Milan, Italy",https://databricks.com/company/careers/open-positions/job?gh_jid=8509691002
Curana Health,Associate Actuary (CMS Regulatory & Bid Pricing),"Remote, US",https://general-careers-curanahealth.icims.com/jobs/3432/associate-actuary-%28cms-regulatory-%26-bid-pricing%29/job
Curana Health,Utilization Management Nurse,"Remote, US",https://general-careers-curanahealth.icims.com/jobs/3475/utilization-management-nurse/job
eko,"Staff Accountant, Accounts Payable","Bentonville, Arkansas",https://job-boards.greenhouse.io/eko/jobs/8520206002
NeueHealth,Front Desk Receptionist - Saginaw Clinic,"Saginaw, Texas, United States",https://job-boards.greenhouse.io/neuehealth/jobs/5980299004
Marathon Health,"Medical Assistant - Spokane, WA","Spokane, WA; United States of America",https://marathonhealth.wd501.myworkdayjobs.com/Marathon-Health-Careers/job/WA-Spokane/Medical-Assistant---Spokane--WA_JR107494
NinjaOne,Senior Release Manager,United States; United States; United States; United States; United States; United States; United States; United States; United States; United States; United States; United States; United States; United States; United States; United States; United States; United States,https://jobs.jobvite.com/ninjaone/job/o6B0zfw0?nl=1&fr=true
Swift Navigation,Director of Business Development Mobile Ecosystem,"San Francisco or California, California, United States",https://swiftnav.bamboohr.com/careers/64
Wonder,"Senior Associate, Program Manager",Chicago; United States of America; HQ; Denver,https://wonder.wd1.myworkdayjobs.com/WG/job/Chicago/Senior-Associate--Program-Manager_JR101054-1
Horizon3.ai,"Director, Mid-Enterprise Sales, TOLA",; Texas,https://jobs.ashbyhq.com/horizon3ai/5a66a993-6cd0-4bac-b94f-61c2eca234a9
Marathon Health,"Nurse Practitioner or Physician Assistant - South Bend, IN","South Bend, IN; United States of America",https://marathonhealth.wd501.myworkdayjobs.com/Marathon-Health-Careers/job/IN-South-Bend/Nurse-Practitioner-or-Physician-Assistant---South-Bend--IN_JR107286
Horizon3.ai,"Director, Mid-Enterprise Sales, Southwest",; Texas,https://jobs.ashbyhq.com/horizon3ai/ae73ae3e-ca0a-4c3c-823e-c0a9b27d4802
Resilience,"Supervisor, Quality Control Aseptic (Day Shift)"," West Chester,  OH , USA ; United States of America",https://resilience.wd1.myworkdayjobs.com/Resilience_Careers/job/USA---OH---West-Chester/Supervisor--Quality-Control-Aseptic--Day-Shift-_R-106758
Plaid,Partner Development Manager- Banking & Wealth,"New York, New York, United States; New York City Office",https://jobs.ashbyhq.com/plaid/43c59544-840c-47ad-8f9b-f7c29d43d136
Resilience,"Senior Specialist, Business Operations"," West Chester,  OH , USA ; United States of America",https://resilience.wd1.myworkdayjobs.com/Resilience_Careers/job/USA---OH---West-Chester/Senior-Specialist--Business-Operations_R-106716
Synthesia,Staff Research Engineer - Video Post Training,"London, United Kingdom; Europe",https://jobs.ashbyhq.com/synthesia/d08a4685-89f9-49e2-b203-1482a3db2c4a
Marathon Health,Technology IT Vendor Management Analyst (Remote - EST),United States of America,https://marathonhealth.wd501.myworkdayjobs.com/Marathon-Health-Careers/job/Remote/Technology-IT-Vendor-Management-Analyst--Remote---EST-_JR107490
Patreon,"Staff Software Engineer, Backend Platform","San Francisco, California, United States; San Francisco; New York",https://jobs.ashbyhq.com/patreon/fbe4a7d5-5621-47fc-b9c7-5a471bd2a608
Plaid,Web Marketing Lead,"Remote, California, United States; San Francisco; New York City Metro",https://jobs.ashbyhq.com/plaid/9090cb70-de30-4ea4-a7d6-5b280839d210
Marathon Health,"Clinical Support Lead Medical Assistant - Lakeland, FL","Lakeland, FL; United States of America",https://marathonhealth.wd501.myworkdayjobs.com/Marathon-Health-Careers/job/FL-Lakeland/Clinical-Support-Lead-Medical-Assistant---Lakeland--FL_JR107448-1
Clio,"Software Development Manager, CBS Monetization",Vancouver; Canada,https://clio.wd3.myworkdayjobs.com/ClioCareerSite/job/Vancouver/Software-Development-Manager--CBS-Monetization_REQ-4740
Marathon Health,"Nurse Practitioner or Physician Assistant - Mishawaka, IN (24 hours/week with benefits & PTO)","Mishawaka, IN; United States of America",https://marathonhealth.wd501.myworkdayjobs.com/Marathon-Health-Careers/job/IN-Mishawaka/Nurse-Practitioner-or-Physician-Assistant---Mishawaka--IN--24-hours-week-with-benefits---PTO-_JR107022
Uniphore,"Manager, Revenue Enablement(Asia)"," Bangalore, India ; India",https://uniphore.wd503.myworkdayjobs.com/Uniphore/job/India---Bangalore/Manager--Revenue-Enablement-Asia-_JR101019
SafeRide Health,Credentialing Audit Supervisor,United States,https://saferidehealth.bamboohr.com/careers/266
flox,Technical Product Marketing Lead,United States,https://wellfound.com/jobs/4128424-technical-product-marketing-lead
Marathon Health,"Medical Assistant - Batesburg, SC","Leesville, Batesburg, SC; United States of America",https://marathonhealth.wd501.myworkdayjobs.com/Marathon-Health-Careers/job/SC-Batesburg-Leesville/Medical-Assistant---Batesburg--SC_JR107466-1
Marathon Health,"Medical Assistant - Berne, IN","Berne, IN; United States of America",https://marathonhealth.wd501.myworkdayjobs.com/Marathon-Health-Careers/job/IN-Berne/Medical-Assistant---Berne--IN_JR107162
Formlabs,Paid Advertising Intern (Summer 2026),"Somerville, MA",https://careers.formlabs.com/job/7847589/apply/?gh_jid=7847589
Clio,"Program Specialist, Learning and Development",Vancouver; Canada,https://clio.wd3.myworkdayjobs.com/ClioCareerSite/job/Vancouver/Program-Specialist--Learning-and-Development_REQ-4851
Clio,"Strategy & Operations Lead, Enterprise",New York; United States of America,https://clio.wd3.myworkdayjobs.com/ClioCareerSite/job/New-York/Strategy---Operations-Lead--Enterprise_REQ-4415-1
Wonder,"Enablement Associate, Continued Education & GTM",Chicago; United States of America,https://wonder.wd1.myworkdayjobs.com/WG/job/Chicago/EEnablement-Associate--Continued-Education---GTM_JR101056-1
Marathon Health,"Nurse Practitioner - South Bend, Mishawaka, Elkhart, Angola, Butler, LaGrange, IN","South Bend, IN; United States of America; LaGrange, IN; Butler, IN; Angola, IN; Elkhart, IN; Mishawaka, IN",https://marathonhealth.wd501.myworkdayjobs.com/Marathon-Health-Careers/job/IN-South-Bend/Nurse-Practitioner---South-Bend--Mishawaka--Elkhart--Angola--Butler--LaGrange--IN_JR107486
Tempus Labs,"Area Director, Enterprise Solutions",United States of America,https://tempus.wd5.myworkdayjobs.com/Tempus_Careers/job/Remote---Florida/Area-Director--Enterprise-Solutions_JR202600353
Clio,Enterprise Strategy & Analytics Senior Associate,Toronto; Canada; Vancouver; Calgary,https://clio.wd3.myworkdayjobs.com/ClioCareerSite/job/Toronto/Enterprise-Strategy---Analytics-Senior-Associate_BF-REQ-4069
Fizz,Account Manager,; New York,https://jobs.ashbyhq.com/fizz/f478a187-cbdc-4d6f-81a8-a63f4031f954
Tempus Labs,"Area Director, Enterprise Solutions",United States of America,https://tempus.wd5.myworkdayjobs.com/Tempus_Careers/job/Remote---Illinois/Area-Director--Enterprise-Solutions_JR202600354
Monte Rosa Therapeutics,"Manager, Regulatory Operations","Boston, MA, US",https://careers-monterosatx.icims.com/jobs/1203/manager%2c-regulatory-operations/job
SingleStore,Software Engineer,India (Remote),https://job-boards.greenhouse.io/singlestore/jobs/7790334
Formlabs,FN - 3D Printing Operations Lead,"Billerica, MA",https://careers.formlabs.com/job/7831625/apply/?gh_jid=7831625
Horizon3.ai,Field & Channel Marketing Manager - Northern Europe,"Amsterdam, Netherlands; Amsterdam, Netherlands; London",https://jobs.ashbyhq.com/horizon3ai/d8abbccd-fe04-48ba-80a2-9944b7d0218f
BuzzFeed,"Senior Politics Reporter, Conservatives",Washington D.C,https://boards.greenhouse.io/buzzfeed/jobs/7828334?gh_jid=7828334
Radiology Partners,Mammography Technologist,"Nashville, TN",https://indeed.com/cmp/Radiology-Partners/jobs?jk=54722b0d2fd12494
Formlabs,Marketing Analytics Intern (Summer 2026),"Somerville, MA",https://careers.formlabs.com/job/7843566/apply/?gh_jid=7843566
Radiology Partners,CT Technologist | Float,"Nashville, TN",https://indeed.com/cmp/Radiology-Partners/jobs?jk=7daf9e08b395aca3
Radiology Partners,Remote General Radiologist - Independent Contractor - Medical X-Ray Consultants,Remote,https://indeed.com/cmp/Radiology-Partners/jobs?jk=65ddfbf55b07e960
Databricks,Commercial Account Executive,"Austin, Texas; Boston, Massachusetts; Chicago, Illinois; Denver, Colorado; New York City, New York; San Francisco, California; Seattle, Washington; Washington, D.C.",https://databricks.com/company/careers/open-positions/job?gh_jid=8519576002
Bugcrowd,Enterprise Account Executive,Remote - US,https://boards.greenhouse.io/bugcrowd/jobs/7843715?gh_jid=7843715
Mejuri,Stylist (Retail) (Part-time),"South Coast Plaza, Costa Mesa",https://job-boards.greenhouse.io/mejuri/jobs/4675446006
Mejuri,3IC (Retail) (Full-time),"The Galeries, Sydney",https://job-boards.greenhouse.io/mejuri/jobs/4675464006
Mejuri,Stylist (Retail) (Part-time),Westfield Topanga,https://job-boards.greenhouse.io/mejuri/jobs/4675436006
Mejuri,Floor Lead (Retail) (Part-time),"Abbot Kinney, Venice",https://job-boards.greenhouse.io/mejuri/jobs/4675449006
Mejuri,Floor Lead (Retail) (Part-time),"New York City, New York",https://job-boards.greenhouse.io/mejuri/jobs/4675405006
Robinhood,Cashiering Support Associate,"Chicago, IL; Clearwater, FL; Westlake, TX",https://boards.greenhouse.io/robinhood/jobs/7768865?t=gh_src=&gh_jid=7768865
Bugcrowd,Enterprise Account Executive,Remote - US,https://boards.greenhouse.io/bugcrowd/jobs/7843296?gh_jid=7843296
Cloudflare,"Senior Account Executive, LATAM",Hybrid,https://boards.greenhouse.io/cloudflare/jobs/7839183?gh_jid=7839183
Cloudflare,Territory Account Executive - Digital Native Start Ups,Hybrid,https://boards.greenhouse.io/cloudflare/jobs/7735836?gh_jid=7735836
Clio,"Development Manager, Draft",Vancouver; Canada,https://clio.wd3.myworkdayjobs.com/ClioCareerSite/job/Vancouver/Development-Manager_REQ-4673
Mejuri,Stylist (Retail) (Part-time),"London, UK",https://job-boards.greenhouse.io/mejuri/jobs/4675253006
Mejuri,Floor Lead (Retail) (Part-time),"London, UK",https://job-boards.greenhouse.io/mejuri/jobs/4675255006
Cloudflare,Forward Deployed Engineer,Hybrid,https://boards.greenhouse.io/cloudflare/jobs/7778796?gh_jid=7778796
SingleStore,Software Engineer,Portugal,https://job-boards.greenhouse.io/singlestore/jobs/7430273
Mejuri,District Manager -Southwest,Los Angeles,https://job-boards.greenhouse.io/mejuri/jobs/4675214006
Cloudflare,"Solutions Engineer, Central & Eastern Europe - Czech Speaking",Hybrid,https://boards.greenhouse.io/cloudflare/jobs/7831414?gh_jid=7831414
Databricks,Deployment Strategist,"Sydney, Australia",https://databricks.com/company/careers/open-positions/job?gh_jid=8516118002
Curana Health,Nurse Practitioner - National After-Hours Team - part time - NC License,"Raleigh, NC, US",https://general-careers-curanahealth.icims.com/jobs/3093/nurse-practitioner---national-after-hours-team---part-time---nc-license/job
Curana Health,Psychotherapist/Counselor,"Charleston, SC, US",https://general-careers-curanahealth.icims.com/jobs/3472/psychotherapist-counselor/job
Curana Health,Nurse Practitioner or Physician Assistant - $10k Sign On Bonus,"Grand Rapids, MI, US",https://general-careers-curanahealth.icims.com/jobs/3474/nurse-practitioner-or-physician-assistant---%2410k-sign-on-bonus/job
Databricks,Solutions Architect (Greater China Region),Singapore,https://databricks.com/company/careers/open-positions/job?gh_jid=8499584002
Curana Health,Psychotherapist/Counselor,"Asheville, NC, US",https://general-careers-curanahealth.icims.com/jobs/3416/psychotherapist-counselor/job
BuzzFeed,"Senior Politics Reporter, Elections","Washington, D.C",https://boards.greenhouse.io/buzzfeed/jobs/7809267?gh_jid=7809267
NinjaOne,Sales Development Representative,"Austin, Texas, United States",https://jobs.jobvite.com/ninjaone/job/oZG1zfwZ?nl=1&fr=true
DataRobot,DevOps Engineer II,"Boston, Massachusetts, US; United States of America; New York, New York, US",https://datarobot.wd1.myworkdayjobs.com/DataRobot_External_Careers/job/Boston-Massachusetts-US/DevOps-Engineer-II_R-102665
Synthesia,"Staff Fullstack Engineer, Avatars","London, United Kingdom; Europe",https://jobs.ashbyhq.com/synthesia/3f9d85f6-0750-400f-a129-6a0f8ab76476
Synthesia,"Staff Backend Engineer, Avatars","London, United Kingdom; Europe",https://jobs.ashbyhq.com/synthesia/8a301daa-94db-431f-8385-ad00bb215eda
Champions Oncology,"Research Technician I, Support Team","Rockville, MD, USA",https://www.paycomonline.net/v4/ats/web.php/portal/8E074C8045885157668F3D28842C8B65/jobs/402319
Tempus Labs,"Clinical Account Executive, Fort Lauderdale",United States of America,https://tempus.wd5.myworkdayjobs.com/Tempus_Careers/job/Remote---Florida/Clinical-Account-Executive--Panhandle_JR202600338
Wonder,"Sr Vice President, Product","New York, NY; United States of America; Chicago",https://wonder.wd1.myworkdayjobs.com/WG/job/New-York-NY/Head-of-Product_JR101062-1
Synthesia,"Staff Software Engineer, Voices","London, United Kingdom; Europe",https://jobs.ashbyhq.com/synthesia/dfe4614e-040d-4447-885b-8f0827428f6e
Clio,Retention & Subscription Specialist (English & Spanish),Dublin; Ireland,https://clio.wd3.myworkdayjobs.com/ClioCareerSite/job/Dublin/Retention---Subscription-Specialist--English---Spanish--_REQ-4528
Tempus Labs,"Clinical Account Executive, DC",United States of America,https://tempus.wd5.myworkdayjobs.com/Tempus_Careers/job/Remote---District-of-Columbia/Clinical-Account-Executive--DC_JR202600345
Horizon3.ai,"Mid-Market Account Executive, Sydney","; Sydney, Australia",https://jobs.ashbyhq.com/horizon3ai/7a8fee97-ef77-41d3-bb17-3759b38cfb40
Horizon3.ai,"Enterprise Account Executive, Melbourne","; Melbourne, Australia",https://jobs.ashbyhq.com/horizon3ai/a57c5757-ca01-43ec-b4ba-cb850a551fcd
Wonder,Client Success Manager,Chicago; United States of America,https://wonder.wd1.myworkdayjobs.com/WG/job/Chicago/Client-Success-Manager_JR101060-1
Cloudflare,"Senior Territory Account Executive, Digital Native",Hybrid,https://boards.greenhouse.io/cloudflare/jobs/7830335?gh_jid=7830335
Databricks,Resident Solutions Architect,"Western Australia, Australia",https://databricks.com/company/careers/open-positions/job?gh_jid=8514430002
VAST Data,Account Executive - Healthcare,New York,https://www.comeet.com/jobs/vastdata/43.001/account-executive---healthcare/7D.761
VAST Data,Account Executive - Insurance,"Philadelphia, Pennsylvania",https://www.comeet.com/jobs/vastdata/43.001/account-executive---insurance/7D.763-C1.30E
VAST Data,Account Executive - Insurance,"East Coast, United States",https://www.comeet.com/jobs/vastdata/43.001/account-executive---insurance/7D.763
VAST Data,Account Executive - Life Sciences,"East Coast, United States",https://www.comeet.com/jobs/vastdata/43.001/account-executive---life-sciences/7D.762
VAST Data,Account Executive - Insurance,Boston,https://www.comeet.com/jobs/vastdata/43.001/account-executive---insurance/7D.763-E3.301
UrbanStems,Senior Software Engineer - Supply Chain Systems,United States,https://www.linkedin.com/jobs/view/senior-software-engineer-supply-chain-systems-at-urbanstems-4404864930
Sentry,"Senior Security Engineer, Application & Platform Security","San Francisco, California, United States; San Francisco, California",https://jobs.ashbyhq.com/sentry/361dfd45-650b-4f0a-9182-742e70a6c5ee
Embrace,Senior iOS SDK Engineer,"United States; Canada, US Remote - Pacific Time",https://job-boards.greenhouse.io/embrace/jobs/5810605004
Tempus Labs,"Senior Analyst, Data Operations",Chicago; United States of America,https://tempus.wd5.myworkdayjobs.com/Tempus_Careers/job/Chicago/Senior-Analyst--Data-Operations_JR202600201
Marathon Health,"Family Medicine Physician - Cuyahoga Falls, OH (30 hours/week with full benefits & PTO)","Cuyahoga Falls, OH; United States of America",https://marathonhealth.wd501.myworkdayjobs.com/Marathon-Health-Careers/job/OH-Cuyahoga-Falls/Family-Medicine-Physician---Cuyahoga-Falls--OH--30-hours-week-with-full-benefits---PTO-_JR107477
Mejuri,Lead Piercer (Part-Time),"Oakbrook, Chicago",https://job-boards.greenhouse.io/mejuri/jobs/4654260006
SetPoint Medical,Territory Manager,Offsite USA,https://recruiting.paylocity.com/Recruiting/Jobs/Details/3697184
Marathon Health,PRN Family Nurse Practitioner,"Colorado Springs, CO; United States of America",https://marathonhealth.wd501.myworkdayjobs.com/Marathon-Health-Careers/job/CO-Colorado-Springs/PRN-Family-Nurse-Practitioner_JR105088
Marathon Health,"PRN Nurse Practitioner - Saint Augustine, FL","St Augustine, FL; United States of America; Ponte Vedra, FL; St Augustine, FL 32086",https://marathonhealth.wd501.myworkdayjobs.com/Marathon-Health-Careers/job/FL-St-Augustine/PRN-Nurse-Practitioner_JR105002
"goop,com","Store Manager, goop Bond St.","New York, NY (Retail)",https://job-boards.greenhouse.io/goop/jobs/5872676004
Marathon Health,PRN Medical Assistant,"Sidney, OH; United States of America; Wapakoneta, OH; Van Wert, OH; Saint Henry, OH",https://marathonhealth.wd501.myworkdayjobs.com/Marathon-Health-Careers/job/OH-Sidney/PRN-Medical-Assistant_JR106668
Marathon Health,"Family Physician - 40 Hours Weekly, Ages 2+ (Clifton, NJ)","Clifton, NJ; United States of America",https://marathonhealth.wd501.myworkdayjobs.com/Marathon-Health-Careers/job/NJ-Clifton/Physician_JR106102
Databricks,"Sr. Product Manager, DBSQL","San Francisco, California",https://databricks.com/company/careers/open-positions/job?gh_jid=7924423002
Marathon Health,Nurse Practitioner,"Loveland, CO; United States of America",https://marathonhealth.wd501.myworkdayjobs.com/Marathon-Health-Careers/job/CO-Loveland/Nurse-Practitioner_JR107180
Knotch,Enterprise Account Executive,"New York, NY; Remote (United States)",https://ats.rippling.com/knotch-inc/jobs/a6691fd8-c951-478f-9031-fb6e54d21e1d
Databricks,"Strategic Enterprise Hunter Account Executive, Financial Services","Boston, Massachusetts; New Jersey; New York City, New York; Remote - Texas",https://databricks.com/company/careers/open-positions/job?gh_jid=8346287002
Embrace,Enterprise Account Executive,(Remote) United States - East Coast,https://job-boards.greenhouse.io/embrace/jobs/5591155004
Inkitt,Viral Video Editor (Hook Specialist),San Francisco,https://jobs.lever.co/inkitt/7af3c5c3-7946-4399-b426-6b71deee0375
Genies,Lead Full Stack Engineer,"Los Angeles, California, U.S.; Genies LA",https://jobs.ashbyhq.com/genies/1411d897-2913-4631-969a-924477f8ffdb
Resilience,"Manufacturing Technician II, Filling"," West Chester,  OH , USA ; United States of America",https://resilience.wd1.myworkdayjobs.com/Resilience_Careers/job/USA---OH---West-Chester/Manufacturing-Technician-II--Filling--Dayshift-_R-105136
Databricks,Field CTO - America Industries,United States,https://databricks.com/company/careers/open-positions/job?gh_jid=8306218002
Uniphore,Senior Software Engineer — Data Platform & MAI," Palo Alto,  CA , USA ; United States of America",https://uniphore.wd503.myworkdayjobs.com/Uniphore/job/USA---CA---Palo-Alto/Senior-Software-Engineer---Data-Platform---MAI_JR101004
Databricks,Staff Software Engineer - Distributed Data Systems,"San Francisco, California",https://databricks.com/company/careers/open-positions/job?gh_jid=5646855002
Robinhood,"Product Manager, Money Movement","Menlo Park, CA; New York, NY",https://boards.greenhouse.io/robinhood/jobs/7747728?t=gh_src=&gh_jid=7747728
Databricks,"Chief of Staff, to the CPO","San Francisco, California",https://databricks.com/company/careers/open-positions/job?gh_jid=8479022002
Veza,Identity LCM Architect,"Remote, USA",https://job-boards.greenhouse.io/veza/jobs/5787025004
Houzz,Field Sales Representative,Remote - US,https://jobs.lever.co/houzz/0ad8d32e-86b9-4766-89ca-5ac20c6acae7
Plaid,Content Lead,"San Francisco, California, United States; San Francisco HQ",https://jobs.ashbyhq.com/plaid/56c43ecb-5ed7-49d6-8726-0c17e17505d3
Databricks,Sr. Engineering Manager - Customer Experience Intelligence (CXI),"Mountain View, California; San Francisco, California",https://databricks.com/company/careers/open-positions/job?gh_jid=8436912002
Databricks,Sr. Staff Software Engineer - Unity Catalog Data Governance,"Bellevue, Washington",https://databricks.com/company/careers/open-positions/job?gh_jid=7993609002
Clio,Head of Demand Generation,United States of America; Vancouver; Toronto,https://clio.wd3.myworkdayjobs.com/ClioCareerSite/job/Remote---NY-USA/Director--Demand-Generation_BF-REQ-4049
Robinhood,Senior iOS Engineer,"Menlo Park, CA; New York, NY",https://boards.greenhouse.io/robinhood/jobs/6675127?t=gh_src=&gh_jid=6675127
Aquabyte,Senior Software Engineer - Streaming Video,San Francisco Bay Area,https://jobs.lever.co/aquabyte/401fc51c-8f1f-4a56-a4f4-b701fe743fbf
Clio,"Principal Account Executive, Enterprise vLex, AM Law 150",New York; United States of America,https://clio.wd3.myworkdayjobs.com/ClioCareerSite/job/New-York/Principal-Account-Executive--Enterprise-vLex--AM-Law-150_BF-REQ-4202
Mejuri,Floor Lead (Retail) (Part-time),"Stanford, Palo Alto",https://job-boards.greenhouse.io/mejuri/jobs/4673768006
Uniphore,Sr. Staff Software Engineer — Data Platform & MAI," Palo Alto,  CA , USA ; United States of America",https://uniphore.wd503.myworkdayjobs.com/Uniphore/job/USA---CA---Palo-Alto/Principal-Software-Engineer---Data-Platform---MAI_JR101003-1
Pulumi,Enterprise Account Executive - Bay Area,"Bay Area, San Fransisco",https://job-boards.greenhouse.io/pulumicorporation/jobs/7702120003
CVRx,"Associate Territory Manager - MedTech (Salt Lake City, UT)","Salt Lake City, UT",https://jobs.lever.co/CVRx/dad9a1cc-4611-46f0-800c-40edf24590f4
